{
  "$schema": "https://json-schema.org/draft/2020-12/schema",
  "$id": "CaseCorrections@1",
  "type": "object",
  "required": [
    "schema",
    "feature_id",
    "run_id",
    "generated_at",
    "generator",
    "status",
    "total",
    "by_category",
    "corrections_md",
    "apply_command"
  ],
  "additionalProperties": false,
  "properties": {
    "schema": { "type": "string", "const": "CaseCorrections@1" },
    "feature_id": { "type": "string", "pattern": "^\\d{4}-\\d{2}-[a-z0-9]+(?:-[a-z0-9]+)*$" },
    "run_id": {
      "type": "string",
      "pattern": "^\\d{8}-\\d{4}-(?:(?:preflight|run|selfrun|repair|baseline)-\\d{2}|[a-z0-9]{8})$"
    },
    "generated_at": { "type": "string", "format": "date-time" },
    "generator": { "type": "string", "const": "playwright-automation@1" },
    "status": {
      "type": "string",
      "enum": ["pending", "applying", "applied", "aborted"]
    },
    "total": { "type": "integer", "minimum": 0 },
    "by_category": {
      "type": "object",
      "required": [
        "ui_text_drift",
        "business_rule",
        "ambiguous_step",
        "dependency_missing",
        "unverifiable_assertion",
        "wrong_priority",
        "duplicate",
        "missing_coverage"
      ],
      "additionalProperties": false,
      "properties": {
        "ui_text_drift": { "type": "integer", "minimum": 0 },
        "business_rule": { "type": "integer", "minimum": 0 },
        "ambiguous_step": { "type": "integer", "minimum": 0 },
        "dependency_missing": { "type": "integer", "minimum": 0 },
        "unverifiable_assertion": { "type": "integer", "minimum": 0 },
        "wrong_priority": { "type": "integer", "minimum": 0 },
        "duplicate": { "type": "integer", "minimum": 0 },
        "missing_coverage": { "type": "integer", "minimum": 0 }
      }
    },
    "corrections_md": { "type": "string", "minLength": 1 },
    "apply_command": { "type": "string", "pattern": "^/case-edit apply-corrections " }
  }
}
