{
  "schema": "CaseCorrections@1",
  "feature_id": "2026-07-data-assets-integration-test",
  "run_id": "20260702-1131-dsstd004",
  "generated_at": "2026-07-02T03:37:56Z",
  "generator": "playwright-automation@1",
  "status": "pending",
  "total": 0,
  "by_category": {
    "ui_text_drift": 0,
    "business_rule": 0,
    "ambiguous_step": 0,
    "dependency_missing": 0,
    "unverifiable_assertion": 0,
    "wrong_priority": 0,
    "duplicate": 0,
    "missing_coverage": 0
  },
  "corrections_md": "runs/20260702-1131-dsstd004/case-corrections.md",
  "apply_command": "/case-edit apply-corrections workspace/dataAssets/features/v7.0.0/【v700】【数据资产】数据资产集成用例 20260702-1131-dsstd004"
}
